{"attempt_number":1,"capture_id":"m10capture_7e85087b7eef270d86d3c63520485a320433c29af5012dda02458bdcd8161758","capture_mode":"SESSION_CAPTURED","captured_at":"2026-09-11T12:49:46Z","execution_id":"m10-static-evidence-m8-b1-u05-l02-speaking-r2","model":"UNKNOWN","parameters":{},"prompt_sha256":"f27e77a32f0606835f14ce0bacf1c4c2593fb0fb1e744eb781f10cc6160fe10e","provider":"UNKNOWN","provider_authenticated":false,"raw_response_sha256":"23e4fa4c34ce61f23e20ae9adc2d883207b516da343815a8c62ebdcd346998a8","record_type":"m10_regeneration_capture","run_id":"m10run_bb5f15082da3173d95f542bbf44b6eded7224e978f53dde7d46a71d5efdc49c2","schema_version":"1.0","seed":null}
